name,image,class,subclass,tags,description,hp,hp_backed,hp_cooked,effect_cooked,quality_lvl,potential,duration_bonus_cooked,selling_price,selling_mon,dye_color,food_recipe,armor_upgrade,compendium_id,notes,buying_price,shop
Acorn,40px-BotW_Acorn_Icon.png?version=5b1bf1f5aa8c068af4e515d9b8966182 (https://dl.airtable.com/RLSayh9XSRmYqqsWrUgv_40px-BotW_Acorn_Icon.png%3Fversion%3D5b1bf1f5aa8c068af4e515d9b8966182),Material,Ingredient,,"Often found on the ground near trees. Squirrels adore this nut, so you may have competition while foraging. Add one to a meal for a nutty seasoning.",0.25,0.5,1,,,,"First 0:50, 0:30",2,,Brown,"Sautéed Nuts, Roasted Acorn, Nutcake","Cap of the Wild, Trousers of the Wild, Tunic of the Wild",,,,
Amber,40px-BotW_Amber_Icon.png?version=614817377ae1915b528adb5e826a50c7 (https://dl.airtable.com/AYBFmxdQSWyJLFZLxael_40px-BotW_Amber_Icon.png%3Fversion%3D614817377ae1915b528adb5e826a50c7),Material,Ore,,A fossilized resin with a caramelesque sheen to it. It's been valued as a component in decorations and crafting since ancient times.,,,,,,,,30,,Orange,,"Amber Earrings, Cap of Time, Hylian Hood, Hylian Trousers, Hylian Tunic, Trousers of Time",,,,
Apple,40px-BotW_Apple_Icon.png?version=379f73557fc88ed5370fe17aaa73ba8f (https://dl.airtable.com/38gZoH3Tg6g0WCubhCVV_40px-BotW_Apple_Icon.png%3Fversion%3D379f73557fc88ed5370fe17aaa73ba8f),Material,Fruit,,"A common fruit found on trees all around Hyrule. Eat it fresh, or cook it to increase its effect.",0.5,0.75,1,,,,0:30,3,,Red,"Energizing Honeyed Apple, Hot Buttered Apple, Baked Apple, Apple Pie, Fruitcake, Fruit and Mushroom Mix, Simmered Fruit, Copious Simmered Fruit",,,,,
Armoranth,40px-BotW_Armoranth_Icon.png?version=631ec0cafe110692871546e320b826b1 (https://dl.airtable.com/p6oIONYSSaVNwlSE6eNn_40px-BotW_Armoranth_Icon.png%3Fversion%3D631ec0cafe110692871546e320b826b1),Material,Plant,,"This tough medicinal plant cannot be broken, but it can be cooked. Its durable yet flexible fibers raise your defense when cooked into a dish.",,0.5,,Tough,1,1,0:50,5,,Purple,Roasted Armoranth,,,,,
Armored Carp,40px-BotW_Armored_Carp_Icon.png?version=35135a16f8e41331d112e778f8b038b6 (https://dl.airtable.com/qOFeZUILSGSTL5UWeaXw_40px-BotW_Armored_Carp_Icon.png%3Fversion%3D35135a16f8e41331d112e778f8b038b6),Material,Seafood,Fish,"Calcium deposits in the scales of this ancient fish make them as hard as armor. Cooking it into a dish will fortify your bones, temporarily increasing your defense.",1,1.5,2,Tough,2,2,0:50,10,,,"Frozen Carp, Roasted Carp, Fish Skewer, Fish and Mushroom Skewer, Salt-Grilled Fish, Monster Stew",,,,,
Armored Porgy,40px-BotW_Armored_Porgy_Icon.png?version=cc8b787bd80b752f996c5d7dc8df84fa (https://dl.airtable.com/X4C5uoumR72QpeyyaQM4_40px-BotW_Armored_Porgy_Icon.png%3Fversion%3Dcc8b787bd80b752f996c5d7dc8df84fa),Material,Seafood,Fish,"This porgy's body is covered in armor-hard scales. The compounds in its scales, when cooked into a dish, fortify your bones and temporarily boost your defense.",1,1.5,2,Tough,3,3,0:50,10,,,"Roasted Porgy, Porgy Meunière, Seafood Curry, Seafood Fried Rice, Seafood Paella, Fish Skewer, Salt-Grilled Fish, Monster Stew",,,,,
Big Hearty Radish,40px-BotW_Big_Hearty_Radish_Icon.png?version=88e08998032975de4a2673ed5ce73935 (https://dl.airtable.com/baMr52bRHy6FmiYM71UG_40px-BotW_Big_Hearty_Radish_Icon.png%3Fversion%3D88e08998032975de4a2673ed5ce73935),Material,Vegetable,,"This hearty radish has grown much larger than the average radish. It's rich in analeptic compounds that, when cooked into a dish, temporarily increase your maximum hearts.",4,6,30,Hearty,5,5,,15,,Peach,"Roasted Big Radish, Creamy Heart Soup",,,,,
Big Hearty Truffle,40px-BotW_Big_Hearty_Truffle_Icon.png?version=0e1a17b7dda22312bbbe9edfb65f9f98 (https://dl.airtable.com/0KlvpmQCWlQRbFC9VkQe_40px-BotW_Big_Hearty_Truffle_Icon.png%3Fversion%3D0e1a17b7dda22312bbbe9edfb65f9f98),Material,Shroom,,"Years of going unpicked have allowed this hearty truffle to grow quite large. It's chock-full of nutrients. When cooked into a dish, it temporarily increases your maximum hearts.",3,4.5,30,Hearty,4,4,,15,,Black,"Toasted Big Hearty Truffle, Mushroom Skewer, Mushroom Rice Balls, Copious Mushrooms Skewers, Salt-Grilled Mushrooms, Glazed Mushrooms, Meat & Mushroom Skewer, Mushroom Omelet, Mushroom Risotto, Fragrant Mushroom Sauté, Fish and Mushroom Skewer",,,,,
Bird Egg,40px-BotW_Bird_Egg_Icon.png?version=96c3f6201538a8a61d35743f1b6a84c2 (https://dl.airtable.com/hbRtdQVfQgSuRQqAz8FC_40px-BotW_Bird_Egg_Icon.png%3Fversion%3D96c3f6201538a8a61d35743f1b6a84c2),Material,Ingredient,,"A fresh bird egg necessary for making dishes such as omelets and crepes. You can snag them from birds' nests if you're sneaky. Nutritious and delicious, perfect.",1,1.5,2,,,,0:30,3,,Yellow,"Omelet, Hard-Boiled Egg, Campfire Egg, Crab Omelet with Rice, Curry Pilaf, Egg Pudding, Egg Tart, Fried Egg and Rice, Gourmet Poultry Pilaf, Honey Crepe, Plain Crepe, Poultry Pilaf, Prime Poultry Pilaf, Vegetable Omelet, Wildberry Crepe, Mushroom Omelet",,,,,
Bladed Rhino Beetle,40px-BotW_Bladed_Rhino_Beetle_Icon.png?version=50defd689524e0e3ff493593ff0369d5 (https://dl.airtable.com/oqEOK3uqQiqdQ6fgdphX_40px-BotW_Bladed_Rhino_Beetle_Icon.png%3Fversion%3D50defd689524e0e3ff493593ff0369d5),Material,Critter,,This beetle's razor-sharp horns demand that you handle it with care. Boil the horns alongside monster parts to concoct an elixir that will raise your attack power.,,,,Mighty,1,1,0:50,4,,Navy,"Mighty Elixir, Dubious Food",Trousers of the Wild,,,,
Blue Nightshade,40px-BotW_Blue_Nightshade_Icon.png?version=b94a8aee0036847ccf7536a8f8b57cbc (https://dl.airtable.com/mcXuCO7TTKiJdqnCqc1H_40px-BotW_Blue_Nightshade_Icon.png%3Fversion%3Db94a8aee0036847ccf7536a8f8b57cbc),Material,Plant,,"A plant that grows in quieter areas of Hyrule. At night, it gives off a soft glow. Cook with it to increase your stealth.",,,,Sneaky,1,1,2:00,4,,Blue,,"Stealth Chest Guard, Stealth Mask, Stealth Tights",,,,
Bright-Eyed Crab,40px-BotW_Bright-Eyed_Crab_Icon.png?version=0952264e91e7b2d5a0fcf4a0d780a8dd (https://dl.airtable.com/fZz1BLpQhusZR3xyV5gL_40px-BotW_Bright-Eyed_Crab_Icon.png%3Fversion%3D0952264e91e7b2d5a0fcf4a0d780a8dd),Material,Seafood,Crab,"This crab appears in large numbers when it rains. On bite of its delectable meat, and you'll forget all your exhaustion. Replenishes your stamina when cooked into a dish.",1,1.5,2,Energizing,2,3,,10,,,"Frozen Crab, Crab Omelet with Rice, Crab Risotto, Crab Stir-Fry, Blackened Crab, Salt-Grilled Crab, Seafood Skewer, Monster Stew",,,,,
Cane Sugar,40px-BotW_Cane_Sugar_Icon.png?version=ae9bfa4deaa1d0f25c55561f7a974e55 (https://dl.airtable.com/c8o1UOoSuWhxe8a0Sc99_40px-BotW_Cane_Sugar_Icon.png%3Fversion%3Dae9bfa4deaa1d0f25c55561f7a974e55),Material,Ingredient,,"When boiled with other ingredients, the cane breaks down into a sweet juice necessary for making cakes and other sweets. It's commonly found in ingredients stores.",,,,,,,"First 1:20, 0:30",3,,Green,"Apple Pie, Carrot Cake, Egg Pudding, Egg Tart, Fried Bananas, Fruit Pie, Fruitcake, Honey Crepe, Monster Cake, Nutcake, Plain Crepe, Pumpkin Pie, Wildberry Crepe",,,,,
Chickaloo Tree Nut,40px-BotW_Chickaloo_Tree_Nut_Icon.png?version=d387b82d95029d01535e6f1599c31d78 (https://dl.airtable.com/v0wmRLTMSf2IOw0dk6to_40px-BotW_Chickaloo_Tree_Nut_Icon.png%3Fversion%3Dd387b82d95029d01535e6f1599c31d78),Material,Ingredient,,"Small birds love this nut. You can eat it raw for a minor effect, but it can also be added as a spice to other recipes.",0.25,0.5,1,,,,"First 0:40, 0:30",3,,Crimson,"Roasted Tree Nut, Sautéed Nuts, Nutcake",,,,,
Chillfin Trout,40px-BotW_Chillfin_Trout_Icon.png?version=ced3ea1844bdcb8457a634db8580447b (https://dl.airtable.com/9E771p8S1uPn2Ij3bWBQ_40px-BotW_Chillfin_Trout_Icon.png%3Fversion%3Dced3ea1844bdcb8457a634db8580447b),Material,Seafood,Fish,"This blue trout prefers cold bodies of water. Its skin contains enzymes that keep its body cool, and when cooked into a dish, it will temporarily boost your heat resistance.",1,1.5,2,Chilly,3,3,2:30,6,,,"Frozen Trout, Roasted Trout, Fish Skewer, Fish and Mushroom Skewer, Salt-Grilled Fish, Monster Stew",,,,24,Coral Reef
Chillshroom,40px-BotW_Chillshroom_Icon.png?version=6f2eb80c1414dcab67c47feb42a9bd6c (https://dl.airtable.com/Wv3GN7wQ2mSFRTUwdQ8B_40px-BotW_Chillshroom_Icon.png%3Fversion%3D6f2eb80c1414dcab67c47feb42a9bd6c),Material,Shroom,,"Often found at the base of pine trees in cold climates, these mushrooms are cool to the touch and can be used to cook dishes that allow you to stay cool even in arid regions.",0.5,0.75,1,Chilly,2,2,2:30,4,,Blue,"Toasty Chillshroom, Mushroom Skewer, Mushroom Rice Balls, Copious Mushrooms Skewers, Salt-Grilled Mushrooms, Glazed Mushrooms, Meat & Mushroom Skewer, Mushroom Omelet, Mushroom Risotto, Fragrant Mushroom Sauté, Fish and Mushroom Skewer",,,,,
Cold Darner,40px-BotW_Cold_Darner_Icon.png?version=f170a356b48a22fa39d18c96fa266d92 (https://dl.airtable.com/kJeQTu8GTXuoGzZMWEub_40px-BotW_Cold_Darner_Icon.png%3Fversion%3Df170a356b48a22fa39d18c96fa266d92),Material,Critter,,"This dragonfly prefers the cool shade of trees to the warmth of the sun. Its wings disperse heat from its body, which can be cooked into a heat-resistant elixir.",,,,Chilly,2,2,2:30,2,,Blue,"Chilly Elixir, Dubious Food",,,,,
Cool Safflina,40px-BotW_Cool_Safflina_Icon.png?version=afcf900cc5bb3f085dbd64fbcd68faf3 (https://dl.airtable.com/meoOMgNSCprArbwF42kA_40px-BotW_Cool_Safflina_Icon.png%3Fversion%3Dafcf900cc5bb3f085dbd64fbcd68faf3),Material,Plant,,"This medicinal plant grows in high elevations, such as mountains in the Hebra or Gerudo regions. When cooked into a dish, it will temporarily increase your heat resistance.",,,,Chilly,1,1,2:30,3,,Light Blue,,,,,,
Courser Bee Honey,40px-BotW_Courser_Bee_Honey_Icon.png?version=3f3f6fb8b875bdcf3a7023a4fe506696 (https://dl.airtable.com/nHJTvdCdRE6sJ890o1QL_40px-BotW_Courser_Bee_Honey_Icon.png%3Fversion%3D3f3f6fb8b875bdcf3a7023a4fe506696),Material,Ingredient,,Honey straight from the hive is chock-full of nutrients. Cooking this into a meal unlocks the potential of these nutrients and provides a stamina-recovery effect.,2,,4,Energizing,2,3,,10,,Orange,"Energizing Glazed Meat, Energizing Honey Candy, Glazed Seafood, Honeyed Fruits, Energizing Honeyed Apple, Glazed Veggies, Honey Crepe, Glazed Mushrooms","Cap of the Wild, Trousers of the Wild, Tunic of the Wild",,,,
Diamond,40px-BotW_Diamond_Icon.png?version=851936d8b7aea7154898e384ce0b4ec2 (https://dl.airtable.com/vrhVsVRCqo6fKd0V5rsA_40px-BotW_Diamond_Icon.png%3Fversion%3D851936d8b7aea7154898e384ce0b4ec2),Material,Ore,,"The most precious gem one can find in Hyrule, its signature sparkle has charmed Hyruleans for generations. As such, it has sold for a very high price since ancient times.",,,,,,,,500,,White,,Diamond Circlet,,,,
Dinraal's Claw,40px-BotW_Dinraal%27s_Claw_Icon.png?version=f1cf4151045a68a6cca1bc475b8882e1 (https://dl.airtable.com/888yp8hkQfG8fc1i1ZoF_40px-BotW_Dinraal%2527s_Claw_Icon.png%3Fversion%3Df1cf4151045a68a6cca1bc475b8882e1),Material,Monster Part,,"This valuable claw was plucked from the red spirit Dinraal. It was extremely hot before it was removed. You could sell it to a store, but it must have some other use.",,,2,Bonus,2,,3:30,180,,,,,,,,
Electric Darner,40px-BotW_Electric_Darner_Icon.png?version=a1c7f8923358d14cf063563a9aa048fa (https://dl.airtable.com/zlUgSZDQoyLvmmQyR9zi_40px-BotW_Electric_Darner_Icon.png%3Fversion%3Da1c7f8923358d14cf063563a9aa048fa),Material,Critter,,This rare dragonfly only appears in the rain. Its wings direct electricity away from its body. Cook it with monster parts for an electricity-resistant elixir.,,,,Electro,2,2,2:30,2,,Yellow,"Electro Elixir, Dubious Food",,,,,
Electric Safflina,40px-BotW_Electric_Safflina_Icon.png?version=93d8cd3d1ca6634f13d2e9e9d648c60b (https://dl.airtable.com/BE9qiRorT9EjMKsaTayk_40px-BotW_Electric_Safflina_Icon.png%3Fversion%3D93d8cd3d1ca6634f13d2e9e9d648c60b),Material,Plant,,"This medicinal plant grows abundantly in the Gerudo Desert. Its peculiar fibers conduct electricity, which will increase your electricity resistance when cooked into a dish.",,,,Electro,1,1,2:30,3,,Light,,,,,,
Energetic Rhino Beetle,40px-BotW_Energetic_Rhino_Beetle_Icon.png?version=44c9b42747f089db9037400793af9fd0 (https://dl.airtable.com/4GUTmgrZT7WaYSInwqYw_40px-BotW_Energetic_Rhino_Beetle_Icon.png%3Fversion%3D44c9b42747f089db9037400793af9fd0),Material,Critter,,"This valuable beetle can live up to ten years. When cooked with monster parts, its impressive vitality translates into an elixir that will greatly restore your stamina.",,,,Energizing,4,8,,4,,Yellow,"Energizing Elixir, Dubious Food","Cap of the Wild, Trousers of the Wild, Tunic of the Wild",,,,
Endura Carrot,40px-BotW_Endura_Carrot_Icon.png?version=3c19c5d13adeee500e227166989571e0 (https://dl.airtable.com/mzhaJRiNRgSuKfPtn9JA_40px-BotW_Endura_Carrot_Icon.png%3Fversion%3D3c19c5d13adeee500e227166989571e0),Material,Vegetable,,"Highly valued as a medicinal plant, this carrot contains large amounts of nourishing energy. When cooked into a dish, it boosts your stamina beyond its maximum limit.",2,3,4,Enduring,3,3,,30,,Light,"Roasted Endura Carrot, Carrot Cake, Carrot Stew, Vegetable Curry, Vegetable Risotto, Veggie Cream Soup",,,,,
Endura Shroom,40px-BotW_Endura_Shroom_Icon.png?version=3cae62c9ad0e2280e2c53e3479e2b59b (https://dl.airtable.com/EHCFTs4jTRm5DN2liMbP_40px-BotW_Endura_Shroom_Icon.png%3Fversion%3D3cae62c9ad0e2280e2c53e3479e2b59b),Material,Shroom,,A rare yellowish-orange mushroom. Cook it before eating to temporarily increase your stamina limit.,1,1.5,2,Enduring,1,0.5,,6,,Orange,"Toasty Endura Shroom, Mushroom Skewer, Mushroom Rice Balls, Copious Mushrooms Skewers, Salt-Grilled Mushrooms, Glazed Mushrooms, Meat & Mushroom Skewer, Mushroom Omelet, Mushroom Risotto, Fragrant Mushroom Sauté, Fish and Mushroom Skewer",,,,,
Fairy,40px-BotW_Fairy_Icon.png?version=bdec6fb4d1817a550f159bc916492e9b (https://dl.airtable.com/5tjq8uIKSPCOkaEt3rQI_40px-BotW_Fairy_Icon.png%3Fversion%3Dbdec6fb4d1817a550f159bc916492e9b),Material,Ingredient,,"This fairy will fly from your pouch and heal all your wounds the moment you lose your last heart. It's easily mistaken for a firefly at first, but it glows in the daylight as well as night.",5,,10,,,,0:30,2,,,Fairy Tonic,,,Auto used when you die,,
Farosh's Claw,40px-BotW_Farosh%27s_Claw_Icon.png?version=8c072d432f0fc131d1c4f78e967af366 (https://dl.airtable.com/PmyCiTVxQYyg2VwxRlRC_40px-BotW_Farosh%2527s_Claw_Icon.png%3Fversion%3D8c072d432f0fc131d1c4f78e967af366),Material,Monster Part,,"This claw was plucked from the golden spirit Farosh. Its electricity was expelled before it was removed, so it's safe to handle. A store will buy it, but it must have some other use.",,,2,Bonus,2,,3:30,180,,,,"Cap of the Wild, Trousers of the Wild, Tunic of the Wild",,,,
Fireproof Lizard,40px-BotW_Fireproof_Lizard_Icon.png?version=5eb7f91cf159723e628b435f6c57a14a (https://dl.airtable.com/b3L2OthRSgeRtITrHdI9_40px-BotW_Fireproof_Lizard_Icon.png%3Fversion%3D5eb7f91cf159723e628b435f6c57a14a),Material,Critter,,"This rare lizard can only be found in the Eldin region. Its scales have heat-resistant properties, so when cooked with monster parts, it produces a heat-resistant elixir.",,,,Fireproof,1,1,2:30,5,,Gray,"Fireproof Elixir, Dubious Food","Flamebreaker Armor, Flamebreaker Boots, Flamebreaker Helm",,,,
Fleet-Lotus Seeds,40px-BotW_Fleet-Lotus_Seeds_Icon.png?version=b1ac26e16f0e3b373e96c793fa13b6f2 (https://dl.airtable.com/91G6o1xQ8CRfr0D6vb8R_40px-BotW_Fleet-Lotus_Seeds_Icon.png%3Fversion%3Db1ac26e16f0e3b373e96c793fa13b6f2),Material,Fruit,,"The plant that bears these seeds grows near deep water. The roots draw nutrients from the water, which boosts your movement speed when the seeds are cooked into a dish.",0.5,0.75,1,Hasty,2,2,1:00,5,,Green,"Roasted Lotus Seeds, Fruit and Mushroom Mix, Simmered Fruit, Fruit Pie, Fruitcake, Honeyed Fruits, Copious Simmered Fruit",,,,,
Flint,40px-BotW_Flint_Icon.png?version=3e1ab2f0100136fe13eec6b16af793b6 (https://dl.airtable.com/6IYga7pSOaoc3joi3Icv_40px-BotW_Flint_Icon.png%3Fversion%3D3e1ab2f0100136fe13eec6b16af793b6),Material,Ore,,"Strike it with a metallic weapon to generate a spark. The portable fire starter breaks after one use, but it can create a long-lasting flame if you use it near firewood.",,,,,,,,5,,Black,,"Amber Earrings, Diamond Circlet, Opal Earrings, Ruby Circlet, Sapphire Circlet, Topaz Earrings",,,,
Fortified Pumpkin,40px-BotW_Fortified_Pumpkin_Icon.png?version=41cfc6b4cd9f8049449e460707953e33 (https://dl.airtable.com/944uJjiBQCOeFQwcorZ3_40px-BotW_Fortified_Pumpkin_Icon.png%3Fversion%3D41cfc6b4cd9f8049449e460707953e33),Material,Vegetable,,"An extremely tough pumpkin raised in village fields. When cooked, that toughness manifests itself by considerably upping defense.",0.5,0.75,1,Tough,2,2,0:50,5,,Orange,"Pumpkin Pie, Pumpkin Stew, Tough Meat-Stuffed Pumpkin, Baked Fortified Pumpkin, Vegetable Curry, Vegetable Risotto, Veggie Cream Soup",,,,,
Fresh Milk,40px-BotW_Fresh_Milk_Icon.png?version=8c53a5bb141f1a6bacd8b0b5fb2202b4 (https://dl.airtable.com/A2JiaQbqRmyRAhwg90Wf_40px-BotW_Fresh_Milk_Icon.png%3Fversion%3D8c53a5bb141f1a6bacd8b0b5fb2202b4),Material,Ingredient,,This fresh milk comes from Hateno cows and white goats kept in the village. It's delicious on its own but can also be used as an ingredient in soups and stews.,0.5,,1,,,,0:30,3,,White,"Egg Pudding, Hearty Clam Chowder, Honey Crepe, Plain Crepe, Warm Milk, Carrot Stew, Cream of Mushroom Soup, Cream of Vegetable Soup, Creamy Heart Soup, Creamy Meat Soup, Creamy Seafood Soup, Gourmet Meat Stew, Monster Soup, Prime Meat Stew, Pumpkin Stew, Veggie Cream Soup, Wildberry Crepe",,,,,
Giant Ancient Core,40px-BotW_Giant_Ancient_Core_Icon.png?version=1d0231bb704c2966025bc4a67d9e3e91 (https://dl.airtable.com/rkhNGmhRReyxzAHXv9mz_40px-BotW_Giant_Ancient_Core_Icon.png%3Fversion%3D1d0231bb704c2966025bc4a67d9e3e91),Material,Monster Part,,A giant energy crystal made using lost ancient technology. Cores this large are an extremely rare find. A researcher would probably know how to use this.,,,,,3,,3:10,200,100,Gray,,,,,,
Goat Butter,40px-BotW_Goat_Butter_Icon.png?version=e9991fc834be89c8bb0f500d07725e62 (https://dl.airtable.com/oyG4Cm8PT5qmfMaAj44a_40px-BotW_Goat_Butter_Icon.png%3Fversion%3De9991fc834be89c8bb0f500d07725e62),Material,Ingredient,,Butter made from the milk of a domesticated white goat. In addition to being used in dishes like stews and meunière. It's often used when making cakes and other sweets.,,,,,,,"First 1:20, 0:30",3,,Light,"Apple Pie, Carrot Cake, Carrot Stew, Crab Risotto, Curry Pilaf, Egg Tart, Fish Pie, Fruit Pie, Gourmet Meat Stew, Gourmet Poultry Pilaf, Hearty Clam Chowder, Hearty Salmon Muenière, Hot Buttered Apple, Meat Pie, Monster Cake, Monster Soup, Nutcake, Plain Crepe, Porgy Meunière, Poultry Pilaf, Prime Meat Stew, Prime Poultry Pilaf, Pumpkin Pie, Pumpkin Stew, Salmon Risotto, Seafood Meunière, Vegetable Omelet, Vegetable Risotto, Mushroom Omelet, Mushroom Risotto",,,,,
Goron Spice,40px-BotW_Goron_Spice_Icon.png?version=b8b1f2d247bb82bc86ea24aaf37cf30c (https://dl.airtable.com/ai3A7ObpTumfhf7gW8h1_40px-BotW_Goron_Spice_Icon.png%3Fversion%3Db8b1f2d247bb82bc86ea24aaf37cf30c),Material,Ingredient,,"Made from several types of spices, this secret Goron seasoning has been handed down for generations. An initial wave of spiciness paves the way for the sweetness.",,,,,,,0:30,4,,Crimson,"Crab Stir-Fry, Seafood Curry, Spiced Meat Skewer, Curry Pilaf, Curry Rice, Gourmet Meat Curry, Gourmet Poultry Curry, Gourmet Spiced Meat Skewer, Herb Sauté, Meat Curry, Monster Curry, Poultry Curry, Prime Meat Curry, Prime Poultry Curry, Prime Spiced Meat Skewer, Vegetable Curry, Fragrant Mushroom Sauté",,,,,
Hearty Bass,40px-BotW_Hearty_Bass_Icon.png?version=4aa4a39a9faad676ef20af62797da102 (https://dl.airtable.com/BVJGIcDATiIECOOyaIJP_40px-BotW_Hearty_Bass_Icon.png%3Fversion%3D4aa4a39a9faad676ef20af62797da102),Material,Seafood,Fish,"This large fish lives near the shoreline. Its sizable body can restore a lot of nutrient. When cooked into a dish, it will temporarily increase your maximum hearts.",2,3,30,Hearty,2,2,,18,,,"Roasted Hearty Bass, Frozen Hearty Bass, Fish Skewer, Fish and Mushroom Skewer, Salt-Grilled Fish, Monster Stew","Zora Armor, Zora Greaves, Zora Helm",,,,
Hearty Blueshell Snail,40px-BotW_Hearty_Blueshell_Snail_Icon.png?version=d8405d8d563b8b7e4130ad7c56e03be8 (https://dl.airtable.com/jDF8azlGSqa8o9Hl0xhR_40px-BotW_Hearty_Blueshell_Snail_Icon.png%3Fversion%3Dd8405d8d563b8b7e4130ad7c56e03be8),Material,Seafood,Snail,"This snail lives on sandy beaches in large numbers. Its flesh contains a high amount of stimulants, so when cooked into a dish, it temporarily increases your maximum hearts.",3,4.5,30,Hearty,3,3,,15,,,"Icy Hearty Blueshell Snail, Seafood Paella, Blueshell Escargot, Hearty Clam Chowder, Seafood Curry, Seafood Fried Rice, Salt-Grilled Fish, Seafood Skewer, Monster Stew",,,,,
Hearty Durian,40px-BotW_Hearty_Durian_Icon.png?version=d91b25d4e21bccaac6381b2215b60ef5 (https://dl.airtable.com/umYuNgwATtORGb8WoqbV_40px-BotW_Hearty_Durian_Icon.png%3Fversion%3Dd91b25d4e21bccaac6381b2215b60ef5),Material,Fruit,,"This fruit's odor earned it the nickname ""king of fruits"". It offers immense restorative power; dishes cooked with it will temporarily increase your maximum hearts.",3,4.5,30,Hearty,4,4,,15,,Light,"Roasted Hearty Durian, Fruit and Mushroom Mix, Simmered Fruit, Fruit Pie, Fruitcake, Honeyed Fruits, Copious Simmered Fruit",,,,,
Hearty Lizard,40px-BotW_Hearty_Lizard_Icon.png?version=662fed3e92ea16a131219eda5243630c (https://dl.airtable.com/DyVTEQeITOOTODG8Btni_40px-BotW_Hearty_Lizard_Icon.png%3Fversion%3D662fed3e92ea16a131219eda5243630c),Material,Critter,,"This rare lizard lives deep in the forests. It feeds on high-nutrient foods, giving it great vitality. When used to make elixirs, they temporarily increase your maximum hearts.",,,,Hearty,4,4,,20,,Blue,"Hearty Elixir, Dubious Food",,,,,
Hearty Radish,40px-BotW_Hearty_Radish_Icon.png?version=0f15f1bb26842e2f741df01405084fed (https://dl.airtable.com/7nX17sprS0eB8JPp7Tka_40px-BotW_Hearty_Radish_Icon.png%3Fversion%3D0f15f1bb26842e2f741df01405084fed),Material,Vegetable,,A rare radish that grows best in sunny plains. Cook it before eating to temporarily increase your maximum hearts.,2,3.75,30,Hearty,3,3,,8,,Peach,"Roasted Radish, Creamy Heart Soup",,,,,
Hearty Salmon,40px-BotW_Hearty_Salmon_Icon.png?version=e17c03f1bf9acd96e174721f9e61b2b4 (https://dl.airtable.com/ZHMhyRfLQ4eR6VbSc54h_40px-BotW_Hearty_Salmon_Icon.png%3Fversion%3De17c03f1bf9acd96e174721f9e61b2b4),Material,Seafood,Fish,"This fish makes its home in cold water, giving it extra layers of fat. It temporarily increases your maximum hearts when used in cooking.",4,6,30,Hearty,4,4,,10,,,"Salmon Risotto, Hearty Salmon Muenière, Roasted Hearty Salmon, Frozen Hearty Salmon, Fish Skewer, Fish and Mushroom Skewer, Salt-Grilled Fish, Monster Stew",,,,,
Hearty Truffle,40px-BotW_Hearty_Truffle_Icon.png?version=408df381ce420b44411c9efc9aef2e9e (https://dl.airtable.com/KqyXvw0uSVAHig8uIYCO_40px-BotW_Hearty_Truffle_Icon.png%3Fversion%3D408df381ce420b44411c9efc9aef2e9e),Material,Shroom,,This rare mushroom has a rich scent. Cook it before eating to temporarily increase your maximum hearts.,2,3,30,Hearty,1,1,,6,,Black,"Toasted Hearty Truffle, Mushroom Skewer, Mushroom Rice Balls, Copious Mushrooms Skewers, Salt-Grilled Mushrooms, Glazed Mushrooms, Meat & Mushroom Skewer, Mushroom Omelet, Mushroom Risotto, Fragrant Mushroom Sauté, Fish and Mushroom Skewer",,,,,
Hightail Lizard,40px-BotW_Hightail_Lizard_Icon.png?version=2a06f8dcfce45ddd8753e2cc0173c4e9 (https://dl.airtable.com/9OGc2qLrRdeZnuiEjVnL_40px-BotW_Hightail_Lizard_Icon.png%3Fversion%3D2a06f8dcfce45ddd8753e2cc0173c4e9),Material,Critter,,"A lizard found throughout Hyrule. It's a bit slow to react at times, but if given a chance to escape, it will dart off quickly. Cook it with monster parts for a speed-boosting elixir.",,,,Hasty,1,1,1:00,2,,Brown,"Hasty Elixir, Dubious Food","Climber's Bandanna, Climbing Boots, Climbing Gear, Sand Boots, Snow Boots",,,,
Hot-Footed Frog,40px-BotW_Hot-Footed_Frog_Icon.png?version=65b2d8841f277864ba1ae84423663c75 (https://dl.airtable.com/OIqWq11xSxR0x4lKwYUK_40px-BotW_Hot-Footed_Frog_Icon.png%3Fversion%3D65b2d8841f277864ba1ae84423663c75),Material,Critter,,A quick frog that can be found hopping around near water. Cook it with monster parts to draw out its speed-boost effect.,,,,Hasty,2,2,1:00,2,,Green,"Hasty Elixir, Dubious Food","Climber's Bandanna, Climbing Boots, Climbing Gear",,,,
Hydromelon,40px-BotW_Hydromelon_Icon.png?version=f978ce1fa3d5847835e9b8b8d2adbd03 (https://dl.airtable.com/HRH1AKWFRX2abMM2VupY_40px-BotW_Hydromelon_Icon.png%3Fversion%3Df978ce1fa3d5847835e9b8b8d2adbd03),Material,Fruit,,"This resilient fruit can flourish even in the heat of the desert. The hydrating liquid inside provides a cooling effect that, when cooked, increases your heat resistance.",0.5,0.75,1,Chilly,1,1,2:30,4,,Green,"Creamy Heart Soup, Roasted Hydromelon, Fruit and Mushroom Mix, Simmered Fruit, Fruit Pie, Fruitcake, Honeyed Fruits, Copious Simmered Fruit",,,,,
